4/11/2026 14:40:02,p16,22,Male,i'am deeply disappointed and i'am losing confidence,"in this case , i try to analyze without emotion and purely rationally.","This doesn't necessarily affect me because for important things, I have a plan B, C, or something to help me bounce back. Nothing goes as planned, and that's the whole point of life.","I am, of course, happy and proud, and this gives me the confidence I need to stay true to my convictions; but generally speaking, if there are results, I’ve already set myself a new, even more ambitious goal. I also wonder why there is a positive result and whether it’s positive for me or for others","It's only natural that I evaluate the request. I ask myself: Why? What are the implications of making compromises? Is the request unreasonable? What positive impact will these compromises have, and who will be affected by them?","I love sharing, but I’m always shy when I talk about myself and the spotlight is on me, though I have no problem discussing general topics or complimenting others (which doesn’t stop me from giving talks, pitches, etc., haha…). But it’s always interesting; it helps you gauge, to some extent, whether your topic is interesting to others. I adjust my speech based on that. ",tout dépend de quoi on parle. si ce n'est pas un choix en general ce n'est pas du tout plaisant,"""here we go again ! "" , c'est un peu embettant mais je me replonge dedans pour résoudre le probleme","It's not a problem for me; I'm just suggesting it, but I'm not forcing anyone. ","The unexpected is confusing, but I find a way to minimize the impact as much as possible, and if it’s not a problem, then I embrace it with passion.","loss of trust, frustration, and a loss of willingness to cooperate. This can lead to resentment. ","She may feel like no one is listening to her, and she may withdraw into herself.","Usually she gets discouraged, takes a break to think things over, and either gets back to it with renewed energy or gives up on the project","She is proud of her team, happy to have seen the project through to completion, and to be able to celebrate it with those with whom she shared the adventure.",She's going to talk to the team and share her concerns,She's probably touched by the selfless gesture—if there's a good reason for it—and would surely want us to do the same for her.,She's feeling nostalgic; she's going to reminisce about the good old days. ,"She'll ask herself questions to find the answers, and maybe ask others","She'll weigh the pros and cons, consider who will be affected, what people will think, and whether it aligns with her values, etc.",She's stressed about making the wrong choices; she might panic.
4/15/2026 18:32:26,p17,21,Female,I’m hurt,I pick both,I’ frustrated,I feel good,I do,I feel seen ,Is hard,It’s stressful,I do it,I feel stressed ,Get mad,Generate a conflict ,Be unmotivated,Feels happy,Try to debate,Feel hopeful,Nostalgic and sad ,Mind opening ,The one they chose will be the right one,Get the information
4/3/2026 9:13:26,p18,22,Female,your trust is broken ,it feels weird,I am disappointed ,i am relieved ,then i accept ,i feel seen,is really hard,i feel nostalgic ,i overthink ,i feel frustrated ,they feel small ,then he can’t decide,if he doesn’t trust himself ,can feel proud ,talk ,he is impressed ,he would feel sad,because he is not prepared for that,then he has to follow his heart ,that is related to him
4/3/2026 9:22:11,p20,22,Male,Everything is,I do a avdersarial point of vue,I take a step back,I work harder,I dont,I dont care,Dont know how to do goodbyes ,Try something else,Urgency importance matrice,I calm down,Work harder amaze them,Merge both,Work harder or move on,Let them celebrate ,Tell them,She is willing to also sacrifice herself,If you have to then do it with no regrets,TRUE,Find the worst one,Rely on other knowledge 
4/16/2026 4:12:40,p21,21,Male,I reevaluate my relationship with the person,I take too long to decide,I just keep going and hope for better next time,I'm really excited to work more,I understand and try to do an effort,I'm grateful,Hurts but needs to be accepted,I must realize I need to change ,I have a hard time deciding,Then it's not important,They will rebel,They will feel crushed,They can learn from it,Needs to empower others to feel like they're part of the success,Try to make their argument,They feel grateful,It's sad,But it would be immature not to accept that,They will take more time to choose ,It will be a tough choice
4/3/2026 13:07:39,p22,39,Male,I would never contact that person or organisation ever.,Go with the heart,Try harder till you have strength to go. There is always hope if you try.,Not sure,Would never,Would appreciate their time and learn if there was something which can be improved,Never easy but it would be for something more important,"See what broke it, any new upgrades or what not.",I would think again,I will still try and pull it out,"I would leave the place, there is no point fighting if you are not in power. I have tested this a few times and always your supervisor will win",Do the right thing,There must be a great deal of learning from the process. Utilize that for the next process,should celebrate it with the team and give the credit to the team on this.,leave the group,Should appreciate that and compensate it,Definitely something is wrong at the top level. A lot politics ,I don't think someone should change their plan for an organisation.,Think of the one you always dreamed of,Never take a decision if you do not have ample information
4/9/2026 11:35:52,p23,22,Male,a heart is broken.,none of them are right.,I fight harder.,I will retire.,I won't accept.,I feel confident about my teaching skills.,is always hard.,I am always there to fix it.,I feel insecure.,I fight towards having the control.,they tend to overreact.,becomes extremely stressed.,because he was not following the right approach.,thinks on how to improve it.,not take into account certain aspects of the problem. This will lead to a complete failure of the mission.,thinks he is crazy. He should look after himself.,a piece of their heart is left behind together with the role or the place.,", leading to the loss of self confidence and losing motivation towards their final objective.",", he will hesitate to choose the best option because of external opinions.",", which may lead to uncertainty about whether it is correct or not. "
4/5/2026 16:31:23,p24,27,Male,you tend to trust that person less,then it must be right and you feel good,lesson learned,"start the next challenge and work hard again, even harder. Achieving goals and resting is depressing. Being challenged by the journey is the real deal. But prevent getting frustrated during the challenge, though, and give your best during that. Otherwise that's most definitely the worst-case scenario.",Evaluate the situation and see whether it is the best option to compromise. sometimes you need to compromise. ,depends on what he is paying attention to.,is hard but you'll grow from this,sort it out. face criticism of changing a working system sooner and unexpectedly to prevent seeing a working system fail after a long time. ,i overthink it a lot,surrender to the current of the ocean to await the outcome.,accept it. it's your supervisor. one day you become a supervisor and you'd understand their struggles of managing as well.,comprise. you are not always right. learning to comprise could be a skill,lesson learned,should thank the teammates. the unity made you succeed. the leader can be proud of managing the group and gathering the right people.,"see if you can stand your ground when you truly believe in something. But if others don't accept it and choose a different path, and even suffer a defeat in the process, you can be proud of your qualities, and people will listen to you more.",that person is very reliable and good to have arond,need to grow that everything could be temporary,then they haven't really looked into that belief thoroughly enough to be truly convinced,"Life is abstract. You don't always have to be logical and cautious. Take the path your heart desires, even if it seems less logical.",communicate that you are not informed enough. then people would understand your decision straightaway that you were meant to take action spontaneously
4/9/2026 12:30:25,p25,21,Male,"i feel anger and try to find out ""why""",i try to do math of cost-benefit or just simple heads or tails,"i try to find out ""why"", detect causes and try to ensure that things go as hoped next time",i feel the dopamine and reward myself. Also think about the bright future!!,"i try to find turnaround, the legal/ethical ways of going forward.","i appreciate the attention, and return attention back as well","is like hell. Full of anxiety, sad thoughts, sad songs, philosophical thoughts about ""bad"" sides of world","i try to find out ""why it no longer works"", what's changed? what can i do to make it work again? ",i combine math and emotions and try to determine the true first,i go with the flow,they feel disappointment,"they should discuss constructively, or do the math to find the best option or find a middle ground",probably they feel disappointment and if they are still feeling alive about that work try to find out whats wrong.,feels the true honor,either follow the crowd or spread the word and led the change,feels respect for that people and humanity' nature,feels anger and/or disappointment. Probably they will try to come back or try to feel like that important role/place on their next role/place,comprehensively,they should try to find out which one is more meaningful by discussing with others or seeing doing their own deep research with a fresh mind,they feel complete anxiety and uncertainty
4/7/2026 13:12:19,p26,26,Male,I feel sad but won't tell.,I wait until the decision feels right.,I think about the next step.,I feel relieved.,I'll get opinions first.,I felt like I mattered.,hurts but makes me feel grateful.,I try to find new solutions.,I choose by process of elimination.,I accept the situation.,they will tell their colleagues.,their decisions will swing between the two.,they will question their self worth.,thanks everyone.,try to convince others.,they will gain trust in them.,they will try to find a better role.,in their planning skills.,they will gather as much information as possible before deciding.,they would not feel at fault in case of a problem.
4/18/2026 14:51:07,p28,40,Male,trust is gone,choose both,go with the flow,thats nice,i wont,I am fond,should be done,we are in research,its the hardest!,i will let it go,figure it out,it is called life,and then it is over,is happy,say it out loud,then I am impressed,it is tragic,but it is fine.,toss a coin,it is not easy.
4/13/2026 18:44:48,p30,38,Female,I realize I can no longer trust someone ,Choose the one that gives the most options,I figure out what when wrong and what to do next,It builds confidence and security,I see if the outcome is reasonable for both parties. It’s a negotiation.,They bring up the little details later,Grieve it and let it go,Keep trying a few times and then try something new,Think about the dependencies of the tasks and if one decision will change the options for the subsequent decisions,I don’t believe it and I keep trying different things.,They might start to check out,That causes a lot of stress and the weight of trying to please others,They should consider how important it is and then try again,Feels proud,Make noise about it for a while and then eventually quietly disagree,They may become inspired. ,There is a feeling of letting go that comes with the growth,About what the plans would enable them to do,They should use their gut enthusiasm as a guide,As information is never complete. They rely on their experience and logic and must have a bit of fearlessness to take the leap
4/10/2026 18:29:35,p31,57,Male,trust is diminished,look for the two-way door,I get frustrated,look for where to double down,I try to see from the opposite viewpoint,it reinforces my confidence,is a normal part of the cycle of life,there must be a reason. Things don't change on their own.,I try to think for the longer term,Then full speed ahead,"it's a reminder of how normal the situation is, and part of what everybody experiences.",they should shrug off those external expectations.,occasionally. And yet surely learned things in the process.,"rightly deserves significant credit, and should also recognize the team.",disagree respectfully and commit,admiration,it's a loss for both the role/place and the person themselves,in a good way. This is a part of growth.,then they should balance gut feel and analytical tradeoff analysis,thus they should look at what their support network is.
4/7/2026 11:08:30,p32,32,Male,i feel betrayed.,I just pick one.,I'm depressed but try to work with what's on hand.,I celebrate.,I weigh the options and decide what to do.,I'm happy and will pay back the favor.,can be sad.,we need to try to find new solutions.,I choose whatever gets me the furthest.,I do my best but also make sure to keep open options.,they'll be down and not perform as well.,they need to figure out what's more important to them.,they'll be down and doubtful.,feels validated.,argue against it.,they value this sacrifice and will help the person if possible.,they'll be sad.,they'll need to be flexible and update their views.,they'll have a hard time deciding which is more important to them.,they gather whatever information they can and then jump into what feels right.
4/13/2026 10:35:16,p34,32,Female,someone can get hurt,it's hard to choose,I can open myself to other possibilities,it's satisfying,"depending on what it is, I'm more than fine to compromise ",I get curious on what they were paying attention ttoo,can be sad,we need to find other ways,it's a good exercise for priorization,"depending on what it is, I can get anxious or I let it go of expectations",it must be hard for them,it can be conflicting,they can learn a lot,is probabaly going to be happy and proud of their team,try to show their group that the decision is wrong,they might feel inspired or touched,they must have a good reason to do so,that they can control things,it's a good problem to have because it means that there arre meaningful things in the life of the persoon,they can follow their gut
4/10/2026 15:26:27,p35,23,Female,you can't trust the other person anymore,it is difficult to understand what to do,I get really stressed,I feel relieved,i am open to it,i am satisfied and I feel like what I said was interesting,makes me cry,I get frustrated,I sometimes get overwhelmed,I get anxious,they should speak up about it,they should work on themselves and realise expectations of other people don't really matter,so even though the person is frustrated they should try again and not get discouraged by failure,raises a toast,need to argue about it respectfully,they sympathise for the person,they can react very differently,and make them feel stressed,it is very difficult to understand what the right choice might be because in the end there is no right choice,so they should try to gather as much information as they can to then make the final decision
4/8/2026 12:58:18,p36,34,Female,Someone is sad,It's tough to choose,I try again,I am grateful,I'll consider,I'm surprised,End of a chapter,Things change,Decision paralysis,That's life,It's awful,Self-awareness,I empathize,Is happy,Feel conflicted,Feel touched,Feel sad,Paradigm shift,Negotiation,Welcome to my life
4/10/2026 9:46:34,p37,28,Male,I feel unsafe and no trust.,I feel self-affirmed,I figure out what is wrong and how to save it.,I feel relived,I will think about whether it threats my true value.,I will do things more carefully.,I feel sad,I feel there is something changed and I want to know why,I will rank carefully,I will manage my expectations,they will feel sad,they will feel unease and cannot be themselves,they will feel sad,felt grateful to others,try to reflect on what leads to the difference in belief,they will admire him or her,they feel sad,in how the thing works,he feels hard to choose,he feels unsafe
4/14/2026 12:10:10,p38,51,Female,the expectation is unfulfilled.,just pick any one.,I reflect on the experience.,I feel validated.,I consider it carefully before making any action.,I tried to explain my reasoning.,is never an easy task.,try something different.,think of my values.,I reevaluate if it is right for me.,they should consult their advisors.,they should try to discuss it.,they should try another idea.,is the heroine.,bring it up with the leader.,they should acknowledge that person.,They get a goodbye party.,They try to understand themselves better.,They can consult their advisors.,They should act with courage.
4/20/2026 15:40:46,p39,41,Male,I feel betrayed because I trusted those people,I choose the simplest solution or the one that seems easiest to implement,"I'm trying to figure out why, so I can do better next time","I’m obviously happy, but I try to figure out why it worked","I try to find the one that costs me the least, or I just go along with it and see if we can do better later or another time","Usually, I don't care, but then again, it obviously depends on who it is","I’ve done it several times before; in the end, it’s not a big deal—it’s just a tough blow at the time, but in reality, everything eventually passes",try to figure out why and how to approach it differently so that it works again,definitely creation or something creative; otherwise it just ends up coming back on its own,I'm just trying to focus on other things to do and let time take care of the rest,we risk losing people's trust sooner or later,"a setback or conformity, depending on the situation, but in no case for the right reasons",life but we can learn from it,too ?,?,he sympathizes ,it costs him personally,what is beliefs? ,"Life is a gamble; to win, you have to play","After all, isn't that true of most of our decisions?"
4/13/2026 2:12:23,p40,49,Female,trust does not return.,you are never wrong.,you need to learn to be flexible.,you need to celebrate it.,I expect the same in return.,I felt good.,it is hard but that's life!,means you need to learn why to fix it.,it is the seed of what will become.,I can relax!,it will be their worst nightmare.,it will be harder but more rewarding.,"then, it is time to learn, improve and try it again.","need to give them credit and celebrate with them as a peer, not as a leader.",need to say the reasons of the decision aloud with good arguments but accept they might be wrong!,should shout out it.,they need to let it go and never look back.,it will be a pivot point.,it will never be wrong,life is a path of new discoveries.
4/14/2026 11:44:44,p41,28,Male,I normally feel depressed,It makes me feel some difficulties,I maybe feel something goes wrong,I'm filled with joy and pleasure,I may feel some burden,"It makes me a bit stressed, but also happy",to me,I'll try to find some fix,sometime it's hard to me,I'll persuade myself to do my best and let it go,normally disagree with them,it usually create some pressure,if the situation doesn't goes right,should go to say something,launching a debate and try to find the direction,maybe he will be encouraged to do the same ,they normally not that happy,on themselves,he or she has to make a difficult choice,is a challenging task for them
4/13/2026 6:55:26,p42,27,Female,the relationship ends,the things are going on the right way ,I will be despaired,we could be released and emotional,I will think about it carefully ,I would be more careful ,to me a lot ,we have to find another method,I will listen to my heart ,I will tell my self to let it go,they would be angry discretely ,they may want to remain calm contemplate it ,the person should certainly feel depressed ,should be proud,try to discuss it with the member of the group,they can feel grateful and respectul towards them  ,it should be difficult for them,"the person should feel faired, but they know that they should be on ",they may need some suggestions from others ,"they might have no choice, but just keep seeing what happens during the journey 
"
4/11/2026 11:06:14,p43,29,Male,Trust is hurt.,I ask for advice.,I seek why.,You need to enjoy it.,I'll pause and really think.,I try to be worthy.,is important.,cause for contemplation,I need to think,I remember to let go,Context is primord,either answers lie within that person,There is no failing without gaining something.,shouldn't make it about themselves.,hopefully communicate in a healthy way.,They should take note,it will still be a part of them,these moments are one of life's main interests,They should mind the big picture,They must articulate their decision around what they don't know
4/14/2026 9:14:56,p44,46,Male,"Worst thing ever, I hate it. Can be long, but do it. Dire c'est faire. ",No. Choose your path. ,"Adapt, adjust. Engine of creation. Oulipo style of thinking. Positive thing. ",I enjoy the moment. With a smile. ,I don't unless no other choice. Rarely the case. Prefers to break everything. ,The expectation. ,I don't. I avoid that situation. ,Well. Work and find a new way. ,Blank page. What do I want? ,I don't engage where I can't control professionally. ,Constant in the industry. Deal with it or change. ,Trajectories may cross or not. No big deal if we disagree or don't align. Doesn't change my view of others. ,Try again differently. Bypass the jury. ,has to congratulate everyone and is often forgotten. ,I don't understand this one. ,"Recognize empathically, suggest change. ",Next train is gonna be even more exciting. And you can always get back here if not. ,"Well, it's constant. So belief is get used to change. ",White page /pros and cons or do both. ,Life is a risk and an opportunity. Go. 
4/14/2026 12:29:05,p45,43,Female,I feel betrayed.,I use pros and cons list.,I pivot.,I'm happy.,it's OK.,it matters.,is hard but doable.,I change it.,I go with my gut.,I try to embrace it.,it is demotivating.,it depends on their background how they might react.,and this is normal - we cannot control all factors.,gives a speech.,rebel.,they should help if they can.,they can turn to something new.,making flexibility important in such situations.,they should choose according to their values.,and just do the best they can with the information they have.
4/13/2026 4:05:43,p46,21,Female,",trust is broken",I make them both. ,I try to fine good anyway. ,I reward myself,I thing about my gain,I thank him/her,takes time.,I find a new path,I follow my heart,I enjoy the ride,they feel humiliated ,they are lost,they may be deceptive,feels proud,try to convince everyone. ,he does the same,they are wise ,and need a good amount of resilience,the person should follow his heart ,the person should trust his brain
4/14/2026 10:46:52,p48,23,Female,I really don’t like it and think this person is not trustworthy anymore,I choose the most logical one ,I am really disappointed but try to find another plan,I am pretty happy but it’s never as fulfilling as I would first expect it. But it’s great.-,I understand and I try to do my best to do it.,I appreciate.,It’s a bit sad but it doesn’t matter anymore.,I’m frustrated and will do all my best to make it work again.,I feel satisfied.,I’m a bit sad,They might get upset and work less efficiently,They might end up taking the others point of view due to pressure,They might be really sad and feel like everything they do fails,May be really proud and grateful,Gather arguments and convince them to make another decision,They may ask them if they do it consciously ,They may be sad but see the other opportunities and see when to come back,They may not be able to change their plans,They may choose the one that their heart drives them towards,This might be really stressful and might lead to not proper decision.
4/15/2026 12:21:24,p49,23,Male,"I try to understand why this person broke the promise, if the reason isn't satisfying enough, I will lose trust in this person.",I pick the first one that seemed right.,I find a better alternative.,I am glad,I will try my best without betraying myself,I am satisfied and looking forward to meeting this person.,I will replace it with something more evolved,"I am frustrated, I will look a bit for the cause but I will simply use something else",I will weight the pros and cons and do my ranking.,I will be anxious but I will have a second option in case something goes wrong.,They will say nothing unfortunately.,They will comply to the expectations of others.,"They will be demotivated, sad and question their life.",will be proud of him and the teammates,remain silent but will unlikely work their best after,They will be touched.,They will have trouble to adapt and be sad.,They might prefer to do nothing.,They will pick one randomly,They will be scared and anxious but no other choice to adapt quickly
