"Participant ID","Assigned Kegan Stage","Overall Reasoning","Q1","Q2","Q3","Q4","Q5","Q6","Q7","Q8","Q9","Q10","Q11","Q12","Q13","Q14","Q15","Q16","Q17","Q18","Q19","Q20"
"S2.1","Stage 2","Driven entirely by self-interest, concrete rewards, avoiding punishment, and instrumental relationships.","S2: Figure out new way for own needs","S2: Benefits me most/least risk","S2: Find workaround to not lose","S2: Get reward and recognition","S2: Only if I get what I need","S2: Avoid getting gigged","S2: Move to next objective","S2: Change tactics to keep winning","S2: Avoid trouble/protect career","S2: Protect self from fallout","S2: Stay off radar/transfer","S2: Avoid punishment from in charge","S2: Huge waste of time","S2: Gets promotion/credit","S2: Keep mouth shut to avoid trouble","S2: Thinks person is sucker","S2: Focus on perks and rank","S2: Learn rules to not fail","S2: Pick better pay/rank","S2: Safest bet to avoid blame"
"S3.1","Stage 3","Meaning-making is embedded in interpersonal relationships, maintaining peace, and gaining external validation from peers.","S3: Ruins trust/people let down","S3: Ask friends/teachers","S3: Hope someone notices effort","S3: Validation from peers","S3: Keep peace/no arguments","S3: Appreciated/seen","S3: Hope remembered fondly","S3: Look to colleagues","S3: Make people happy","S3: Rely on support system","S3: Talk to coworkers/support","S3: Don't let anyone down","S3: Devastating/need reassurance","S3: Validated by praise","S3: Go along/avoid argument","S3: Praise them as good person","S3: Miss community","S3: Need friends to figure out","S3: Ask respected people","S3: Hope for support/reassurance"
"S3.2","Stage 3","Strong reliance on authority figures (parents/advisors) to define right and wrong, seeking to avoid disappointing them.","S3: Disappoint someone","S3: Ask parents/advisor","S3: Let everyone down","S3: Parents proud","S3: Nobody mad at me","S3: Make good impression","S3: Parents say it's best","S3: Ask someone for advice","S3: Keep everyone happy/expectations","S3: Pray family isn't upset","S3: Figure out what supervisor wants","S3: Listen to people who care","S3: Let everyone counting on them down","S3: Boss is happy","S3: Go along/don't make mad","S3: Good person putting others first","S3: Miss them/good impression","S3: Talk to family/mentor","S3: Makes parents prouder","S3: Ask someone in charge for help"
"S3.3","Stage 3","Identity is embedded in professional reputation, organizational standing, and looking competent to leadership.","S3: Reflects terribly/lose respect","S3: VP prefer","S3: Department doesn't look bad","S3: Look in control","S3: Don't look bad to leadership","S3: Flawless/think highly of me","S3: Expected of you to move up","S3: Scramble before boss notices","S3: Visible to VP","S3: Terrified of mistake reflecting on me","S3: Get back in good graces","S3: Maintain reputation with bosses","S3: Humiliating/messed up","S3: Validated by leadership","S3: Go along/be team player","S3: Team's reputation first","S3: Remembered well/good impression","S3: Adjust so not out of touch","S3: Respect from peers","S3: Worry about looking incompetent"
"S3.4","Stage 3","Meaning revolves around loyalty to a specific group (squad/military), brotherhood, and not letting comrades down.","S3: Let someone down/hurts","S3: Mad no matter what","S3: Failed as leader to squad","S3: Celebrate as team","S3: Neither side hates me","S3: Doing exactly what expected","S3: Leaving friends/bonds","S3: Look to leadership/peers","S3: Torn between friend and duty","S3: Hope I don't get blamed","S3: Betrayed by chain of command","S3: Torn trying to please everyone","S3: Let team and boss down","S3: Made everyone proud","S3: Keep quiet/don't cause trouble","S3: Loyalty and brotherhood","S3: Miss the people served with","S3: Keep people together/follow orders","S3: Don't want to disappoint","S3: Ask buddies/commander"
"S4.1","Stage 4","Self-authored meaning system driven by internal values, core principles, and taking responsibility for own path.","S4: Align with values","S4: Core principles","S4: Adjust strategy","S4: True to own goals","S4: Negotiate details not core","S4: Reflect personal beliefs","S4: Authentic","S4: Author new approach","S4: Internal compass","S4: Control own reaction","S4: Advocate right vs authority","S4: Decide for self","S4: Take responsibility","S4: True to own vision","S4: Stand by values","S4: Strength of character/convictions","S4: Author next chapter","S4: Define new truth","S4: Personal identity","S4: Trust internal framework"
"S4.2","Stage 4","Demonstrates systemic self-authorship, focusing on objective boundaries, internal standards, and managing internal states.","S4: Underlying alignment","S4: Core principles/objectives","S4: Recalibrate approach","S4: Internal satisfaction","S4: Violates core principles","S4: Model clear communication","S4: Process transition","S4: Update operating system","S4: Strategic priorities","S4: Manage internal state","S4: Objective facts/internal narrative","S4: Define boundaries","S4: Feedback to refine","S4: Effective system","S4: Grounded in principles","S4: Healthy boundaries","S4: Life trajectory","S4: Restructure understanding","S4: Authentic self","S4: Guiding principles"
"S4.3","Stage 4","Focuses on structural systemic design, organizational strategy, and self-authored problem-solving frameworks.","S4: Impact on objectives","S4: Core values/strategy","S4: Systemic flaws/process","S4: Validates framework","S4: Protect core principles","S4: Modeling standards","S4: Organizational growth","S4: Redesign process","S4: Overarching goals","S4: Resilient systems","S4: Assess bias vs flaw","S4: Articulate boundary","S4: Structural reasons","S4: Replicate success systemically","S4: Independent judgment","S4: Commitment to values/mission","S4: Next phase of development","S4: Re-evaluation of frameworks","S4: Self-authored path","S4: Internal principles"
"S4.4","Stage 4","Strong internal compass emphasizing boundaries, independent judgment, and identity separate from outcomes.","S4: Adjust expectations/boundaries","S4: Align with long-term goals","S4: Assess next move","S4: True to process","S4: Protect core principles","S4: Internally driven motivation","S4: Personal growth","S4: Reassess methods","S4: Overall vision and values","S4: Grounded in what I control","S4: Advocate for themselves","S4: Internal compass","S4: Extract lessons","S4: Worth isn't solely outcome","S4: Stand by principles","S4: Made freely/not martyrdom","S4: Core identity remains","S4: Construct new understanding","S4: Trajectory evaluation","S4: Trust judgment/accept responsibility"
"S4.5","Stage 4","Self-authored leadership characterized by holding internal standards, accountability, and mission-first philosophy.","S4: Own standards/accountable","S4: Leadership philosophy","S4: Take responsibility/adjust","S4: Affirms sticking to principles","S4: Never compromise core values","S4: Lead by example","S4: Responsibilities/goals","S4: Align with objectives","S4: Serves mission/character","S4: Executing duties/integrity","S4: Advocate staying true to values","S4: Self-authored convictions","S4: Own failure/protect identity","S4: Effective leadership approach","S4: Internal standard of right","S4: Higher purpose above comfort","S4: Take responsibility in next chapter","S4: Update perspective/anchor values","S4: Personal philosophy","S4: Trust internal judgment"
"S5.1","Stage 5","Interindividual awareness seeing limits of paradigms, seeking synthesis, and embracing interconnected systemic complexities.","S5: Systemic pressures","S5: Third paradigm/synthesis","S5: Blind spot in model","S5: New complexities","S5: Transcend disagreement","S5: Expose assumptions","S5: Complex realities","S5: Reimagined container","S5: Biased framework","S5: Adapting vs forcing","S5: Value systems clash","S5: Synthesis/interdependent","S5: Dismantle assumptions","S5: Temporary equilibrium","S5: Test blind spots","S5: Interconnectedness/fluid boundaries","S5: Disembed identity","S5: Beliefs limit capacity","S5: Examine lenses of meaning","S5: Adapt and evolve"
"S5.2","Stage 5","Self-transforming approach embracing the fluidity of boundaries, co-creation, and the continual reshaping of reality.","S5: Relationship evolve","S5: Integrate larger whole","S5: Reality shape perspective","S5: Who I have become","S5: Co-create solution","S5: Co-create shared awareness","S5: Next iteration of who we are","S5: Let go of old system","S5: Growth of whole system","S5: Illusion of separate self","S5: Lens of needs vs complex system","S5: Interconnected dynamic","S5: Reshape understanding","S5: Transforming together","S5: Introduce necessary tension","S5: Permeability of boundaries","S5: Fundamentally rewritten","S5: Fluid beliefs update by reality","S5: Broader context vs isolated desires","S5: Transformed by consequences"
"S23.1","Stage 2/3","Transitional 2/3, deeply embedded in rigid rules (Honor Code) and squad loyalty, moving from instrumental to socialized identity.","S3: Trust of squad","S3: Honor Code/brothers","S3: Lean on squad mates","S3: Represent uniform","S3: Integrity/Honor Code","S3: Setting right example","S3: Duty to team first","S3: Rely on each other","S3: Mission/squad before self","S3: Trust training/people beside me","S3: Chain of command/morale","S3: Team needs above own","S3: Need squad support","S3: Share credit with brothers","S3: Talk to friends/support team","S3: True loyalty/brotherhood","S3: Carry bonds/memories","S3: Core values/friends guide","S3: Serve others/teammate","S3: Trust squad/honorable"
"S34.1","Stage 3/4","Transitional 3/4, pushing back against group expectations to establish self-authored professional boundaries and vision.","S4: Re-evaluate trust","S4: Own gut/consequences","S4: Adjust strategy","S4: Validated approach","S4: Won't bend core vision","S3: Felt respected","S4: Move on/next goals","S4: Design new way","S4: Priorities/objectives","S4: Control/judgment","S4: Dictate worth","S4: Own view/lose who you are","S4: Own failure/learn","S4: Stick to guns","S4: Groupthink dangerous","S4: Chose themselves/not pressured","S4: Build identity","S4: Rewrite rules","S4: Personal vision","S4: Decide for yourself"
"S34.2","Stage 3/4","Transitional 3/4, struggling to differentiate authentic internal beliefs from the expectations of family and friends.","S3: Hurts/respect expectations","S4: What I truly believe","S4: Path is my own","S3: Parents acknowledge","S4: Won't give up core beliefs","S4: Validated own ideas","S4: Grow into independent person","S4: New system that makes sense","S4: Trust own judgment","S4: Control mindset/values","S4: Assert own perspective","S4: Stick to own view despite friction","S4: True to themselves","S4: Individual contribution","S4: Don't blindly follow","S4: Strong personal convictions","S4: Author own life","S4: Believe vs taught","S4: Weigh against internal compass","S4: Trust own gut"
"S34.3","Stage 3/4","Transitional 3/4, experiencing intense inner conflict (sick to stomach) between professional standards and interpersonal harmony.","S3: Hurts relationship","S3: Struggle to explain choice","S3: Let people down","S3: Celebrate together","S3: Middle ground vs best for students","S3: Validated/nervous about approval","S3: Relationships built","S4: Professional judgment","S4: Core standards vs agonizing","S3: Anxious/stay on same page","S4: Right professionally but terrified","S4: Sick to stomach holding standards","S3: Feel terrible/let team down","S3: Relieved administration pleased","S4: Professional responsibility vs sick","S3: Dedication to team","S3: Grieve connections","S3: Hope for peer support","S4: Truest to own standards vs supporting","S4: Internal compass vs disappointing"
"S34.4","Stage 3/4","Transitional 3/4, asserting leadership autonomy and taking definitive responsibility over team consensus.","S4: Damage trust","S4: Trust gut/make call","S4: Take responsibility/adjust","S4: Vision was right","S4: Own final result/control","S4: Fully in charge","S4: Executive decisions","S4: Pivot/create new system","S4: Own goals/priorities","S4: Steering the ship","S4: Stand up for own work","S4: Stick to own view/identity","S4: Own the failure","S4: Direction/final decisions","S4: Override group","S4: Respect dedication vs pushover","S4: Redefine who they are","S4: Take ownership of direction","S4: Personal vision/identity","S4: Trust judgment/burden of leadership"
"S34.5","Stage 3/4","Transitional 3/4, shifting from seeking organizational praise to acting on self-authored principles of justice and integrity.","S4: Violates core values","S4: Standard for what's right","S4: Right thing matters more","S4: Right reasons vs pat on back","S4: Principles of justice","S4: Impact vs importance","S4: True to who I am becoming","S4: Aligns with true goals","S4: Real difference vs happy","S4: Grounded in values","S4: Advocate fair standard","S4: Stand by beliefs despite disappointment","S4: Integrity/right reasons","S4: Impact vs applause","S4: Hold the line on principles","S4: Value of right thing","S4: Identity vs title/validation","S4: Stand for apart from taught","S4: Authentic/effective advocate","S4: Internal compass"
"S34.6","Stage 3/4","Transitional 3/4, deeply aware of own needs but highly susceptible to guilt and fear of disappointing others.","S3: Hurt/understand their side","S4: Align with goals vs worry let down","S3: Blame myself","S3: Proud but hope others recognize","S3: Keep peace/kick myself later","S3: Self-conscious/validated","S4: Logically necessary","S4: New approach vs scary","S4: Prioritize own needs vs putting others first","S3: Worry what people think","S3: Speak up vs terrifying","S4: Paralyzed/true to self vs disappoint","S3: Let everyone down","S3: Relieved everyone happy","S3: Stay quiet to avoid conflict","S3: Admire but wonder about boundaries","S4: Torn right for them vs guilt","S4: Internal conflict/upset people","S4: Figure out want vs others think","S3: Worry make mistake/judged"
"S34.7","Stage 3/4","Transitional 3/4, overwhelmed and paralyzed by the conflict of competing external expectations, recognizing need for boundary.","S3: Hate letting people down","S3: Make both sides happy","S3: Failing people pleasing","S3: Boss satisfied/no guilt","S3: Middle ground for expectations","S3: Pressure to live up","S3: Forced by commitments","S3: Juggle demands","S3: Torn/wish someone would ease up","S3: Anxious about who is upset","S4: Loyalty vs treated right","S3: Pulled apart by expectations","S3: Let team/boss down","S3: Relieved pressure is off","S3: Stuck rocking boat vs expected","S4: Give up to keep peace","S3: Loss of identity tied to others","S3: Explain to people counting on them","S3: Wish one side made decision","S3: Do best/hope nobody furious"
"S45.1","Stage 4/5","Transitional 4/5, starting to deconstruct self-authored systems to integrate competing truths and systemic feedback.","S5: Competing commitments/systemic pressures","S5: Broader perspective/hold both","S5: Limitations of own agenda","S5: Unforeseen complexities","S5: Integrate conflicting frameworks","S5: Own meaning-making/biases","S5: Grieving loss of old paradigm","S5: Blind spots of mental models","S5: Biases/systemic trade-offs","S5: Collective capacity of group","S5: Clash of value systems","S5: Larger complex dynamic","S5: Separate identity/learn from feedback","S5: Interplay of diverse perspectives","S5: Valid if competing value system","S5: Interdependent nature","S5: Uncouple identity/reinvent meaning","S5: Transcend previous ideological framework","S5: Integrates complexities of becoming","S5: Provisional certainty"
"S45.2","Stage 4/5","Transitional 4/5, actively seeking out blind spots in own framework and finding integrated solutions beyond compromises.","S5: Competing commitments vs blame","S5: Underlying assumptions/too narrow","S5: Mental model incomplete","S5: Solving right problem","S5: Integrated solution vs compromise","S5: Test ideas against perspective","S5: Make space for new ways","S5: Framework needs to evolve","S5: Adjust priorities if new data","S5: Adaptable/open to learning","S5: Blind spots in viewing relationship","S5: Limits of own perspective/valid data","S5: Prove approach was incomplete","S5: Differing viewpoints essential","S5: Listen to group/missing something","S5: Larger system overrides individual","S5: Loosen grip on old identity","S5: Disruption shows framework too small","S5: Challenge current way of thinking","S5: Feedback loops to catch wrong"
"S45.3","Stage 4/5","Transitional 4/5, enjoying the breakdown of rigid models, embracing paradox, dialectics, and the fluidity of identity.","S5: Changing context vs moral failure","S5: Higher-order assumption","S5: Fascinated by unexpected reality","S5: Starting point for deeper complexities","S5: Dialectic/transcend conflict","S5: Shared inquiry/not absolute truth","S5: Let go of old paradigms","S5: Breakdown is where learning begins","S5: Priority provisional/context dependent","S5: Relief from closed system","S5: Clashing meaning-making systems","S5: Integrate competing voices","S5: See blind spots in original design","S5: Temporary construct","S5: Friction to complexify understanding","S5: Messy interdependence","S5: Disentangle identity/freeing","S5: Reshape mind that made it","S5: Surface valuable contradictions","S5: Ambiguity/adapt over certainty"